Index,Title,Summary,Full Text,Url
50,BCCI approves pay hike for Indian men's cricket team,"The BCCI has approved a pay hike for Team India following a meeting with Virat Kohli and MS Dhoni on Thursday. This comes months after the BCCI doubled annual retainer amounts of Team India, with Grade A players earning ₹2 crore. Earlier, former coach Anil Kumble had asked BCCI to raise Grade A cricketers' annual retainer amount to ₹5 crore.","The Committee of Administrators (CoA) has approved a pay hike for Team India cricketers after a meeting with skipper Virat Kohli, MS Dhoni and Ravi Shastri in New Delhi on Thursday. The details of the increase in pay will soon be worked out and it is likely the COA will meet the players before they depart for their tour of South Africa late in December. COA chief Vinod Rai said his committee has found a common ground with the players in a path-breaking initiative. The team management was very forthcoming with their recommendations and their thoughts on various issues. This was a path-breaking initiative, we feel we've found a common ground and aligned our thoughts for the betterment of the game - be it the policies under which the player remuneration and FTP will be worked upon. A few months ago, the Indian cricketers' central contracts saw a two-fold rise with top players in group A earning Rs 2 crore annually. Earlier, they were drawing Rs 1 crore. Despite the cent percent hike in annual contracts, the players were apparently still not happy and erstwhile coach Anil Kumble had given a presentation to the the Committee of Administrators about raising it to Rs 5 crore for Grade A cricketers. The CoA, in its third Status Report submitted to the Supreme Court on April 6, had stated about the proposed recommendations on restructuring of central contracts. Unlike reports that players want share from the IPL broadcast revenue, they have never ever said anything like that. Yes, they have spoken about a respectable rise. The COA also understands that their payment structure needs revision, a senior BCCI office bearer was quoted as saying to PTI. However, the COA's decision on the pay hike would need a nod from the BCCI's general body. A Special General Meeting needs to be summoned where all the members will be taking a call. This is as per constitution of BCCI, an official had told PTI on Tuesday. The Indian players believe that someone like Cheteshwar Pujara, who does not have a lucrative IPL contract, needs to be adequately compensated for his skills in Test cricket. Currently the Indian players earn less than 8 percent (7.8 percent) of BCCI revenues. During the meeting on Thursday, it was also decided the team would leave for England two weeks before their first match for the tour of 2018 to prepare and get used to conditions. Last week, Kohli had asked for more time to prepare before challenging overseas tours. Had we got a month off ideally, we would have done a proper preparation in a camp sort of scenario but we have to sort of make do with what we have, Kohli had said before the start of the second Test against Sri Lanka in Nagpur. As usual cramped for time, which I think we needed to assess in future as well because we very easily assess the team when go abroad but we don't look at how many days we have got to prepare before we go to a particular place to play. And everyone starts judging players when results come after Test matches. It should be a fair game, where we get to prepare the way we want to and then we are entitled to be criticised. So we thought this is an ample opportunity for us to challenge ourselves, put us in a situation , Kohli added.",http://indiatoday.intoday.in/story/virat-kohli-coa-pay-hike-overseas-tour-south-africa-england/1/1100338.html?utm_campaign=awesummly&utm_source=awesummly
51,PCB files ₹450 cr compensation claim against BCCI with ICC,"The Pakistan Cricket Board (PCB) has sent a notice of dispute against the BCCI to the ICC for not honouring a bilateral cricket series agreement. The PCB is seeking ₹450 crore in compensation from the BCCI for failing to play bilateral series in 2014 and 2015. The matter will be forwarded to the Dispute Resolutions Committee's Chairman, the ICC said.","Pakistan has kicked off a legal battle against India for not honouring a bilateral cricket series agreement, the sport's governing body confirmed Thursday. The Pakistan Cricket Board (PCB) is seeking US70 million in compensation from the Board of Control for Cricket in India (BCCI) after the country failed to attend two series in 2014 and 2015 as part of a memorandum of understanding signed between the two boards. The International Cricket Council confirmed receiving the notice. The ICC has received a Notice of Dispute from the PCB's lawyers, which will be forwarded to the Chairman of the Dispute Resolutions Committee next week, a spokesman of the ICC said. The ICC Dispute Resolution Committee is headed by Michael Beloff QC who will appoint independent adjudicators to hear the case. The PCB sent a legal notice to their counterparts earlier this year but Indian officials rejected the memorandum as a piece of paper. The arch-rivals have not played a full bilateral series since 2007. New Delhi halted all bilateral sports with Pakistan in the wake of 2008 Mumbai attacks, which India blamed on militants based in Pakistan. Those attacks, which left eight people dead and seven Sri Lanka players and their staff injured, suspended international cricket in Pakistan and forced them to play at neutral venues of United Arab Emirates (UAE). The two planned series between India and Pakistan were due to take place at a neutral venue.",http://www.hindustantimes.com/cricket/pakistan-seeks-70m-compensation-from-india-for-unplayed-cricket-series/story-43Hgmk8mL3DiFYi8AdQcxM.html?utm_campaign=awesummly&utm_source=awesummly
52,Don Bradman was dropped from the team after his debut match,"Legendary batsman Donald Bradman was dropped from the Australian team after a poor performance in his debut Test against England, which started on November 30, 1928. Bradman batted at number seven in his debut innings, scoring 18, and was dismissed for one in the second innings. On his return, Bradman scored 79 and 112 against England. ","Don Bradman took the field for Australia in a Test match for the first time. However, the result was not too happy for the legend or the Australians. In this series, Arunabha Sengupta lists several firsts of Bradmanas career. It was not an uneasy evening for the 20-year-old. His last two First-Class matches had seen him pile up 131, 133 not out, 87 and 132 not out; the second game played for his state against the visiting MCC side. In the ongoing match against the same MCC, this time for an Australian XI, he had battled against difficult bowling in demanding conditions and hit 58 not out as the rest of the batting fell away around him. Now, as he waited restlessly that evening, he knew he had to bat the following day. In the second innings, he had just gone into bat when the stumps were drawn. He had not opened his account yet. Yet, for all the 541 runs for twice out, his heart was not at ease. Even with an average of 140 in the season so far, Don Bradman was not sure that he would be making his Test debut. After all, he had played only 9 First-Class matches in his career. The Australian selectors were not enamoured by the concept of youth. For them, Test cricket was more of an old manas game, or had become one in the first quarter of the new century. Charles Kelleway, one of the seasoned men who was to play in the Test, had been around in First-Class cricket since before Bradmanas birth. So, the young master waited restlessly in his Sydney lodgings, waiting for the announcement. The wireless was on, airing desultory programmes, refusing to broadcast the names. The upcoming genius did not know that Bardsley and the rest had already deliberated for over three hours, and the meeting was going on well into the night. The prospect of facing Maurice Tate, Harold Larwood and Jack White the next day on a wearying track was not an inviting one. Bradman, after the tension-filled sojourn in front of the wireless, informed his landlady that he was retiring to bed. He would read about the team in the papers of the morrow. However, as he tucked himself in, he could hear the sound floating in from the wireless in the adjoining bedroom. After ten minutes, before he had succeeded in drifting off, The Don heard the announcement. The names were called out in alphabetical order. Bradman was the first, followed by Jack Gregory, Clarrie Grimmett, Stork Hendry and the others. The wait had ended, and he was in. The prevailing opinion was that either he or Hendry would perform the role of the 12th man. Yet, eventually it turned out that both played and Ron Oxenham was the one left out. It was the first ever Test to be played at Brisbane. Besides, Percy Chapmanas side was widely acknowledged to be the best ever to visit the country till then. Historical and contemporary signs were against the hosts. It turned out to be an unhappy match for Bradman. For most of the first two days, he retrieved balls from the outfield as Jack Hobbs and Herbert Sutcliffe set the tone with an 85-run partnership before Patsy Hendren took over the show, slamming 169. Even Larwood enjoyed himself, scoring 70 entertaining runs. The total of 521 loomed ominously on the Australians as they went in to bat towards the end of the second day. Soon, Larwood and Tate were skittling them out. The batsmen were knocked over one after the other. Skipper Jack Ryder held Bradman back as the day ended with the hosts on 44 for 4. The following morning, Larwood trapped Hendry leg-before to make it 71 for 5, and with that precarious scorecard in the background, Don Bradman walked in to bat for the first time in a Test. There was plenty of confidence in the strokes that flowed. The boundary was found quickly, and then again. He hit four fours in all, three of them to leg-side, three off Wally Hammond. A delivery on the leg-stump was pushed to the on side for runs. The next one followed the same arc, looked identical. Bradman pushed in a similar manner. The great big hand of Tate had cleverly concealed the slower ball. The thud was ominous and the finger went up. After 33 minutes at the crease Bradman walked back for 18, one of the eight leg-before dismissals in the match. It turned out to be the third-highest score in the innings, after Hendry and Ryder, but Bradman knew he had not delivered. Larwood took 6 and Tate 3, and Australia folded for 122. And then took place a significant event that would affect Bradman much more than the runs he scored and the balls he faced in the match. The lead of 399 notwithstanding, Chapman batted again. Gregory had busted his knee and Kelleway was ill. Hence, Grimmett and Bradmanas fellow debutant Bert Ironmonger had to do bulk of the bowling. England made merry for about six hours, scoring another 342. Australia were set a mammoth 742 to win, the highest target at that time. If Bradman soon developed into a ruthless opponent of England who would pile on runs mercilessly, refusing to concede an inch, there is reason to believe that the English tactics during that debut Test had a lot to do with it. Bradman had never even seen such a sticky before this, let alone batting on one. He lasted four minutes before White sent in his slower ball, and the catch was spooned to Chapman lurking in the off side. As he walked back for a solitary run, Tate playfully accused White of poaching his arabbita. Unfortunately for Tate and England, the young lad overheard the remark. It was probably the second significant event of the match that moulded his career. Both the bowler and the old foe would pay for it dearly for two decades. Australia were bowled out for 66 on that mud cake. England won by 675 runs, the heaviest defeat they had inflicted on their Ashes rivals. Bradman never quite forgot the humiliation handed out at the Exhibition Ground, Brisbane. Nine days later the sides clashed at the SCG in the second Test. A quarter of an hour before the start of the match, captain Ryder informed young Bradman that he would be the 12th man. That was the only occasion in any form of cricket that Bradman would play that unenviable role of carrying drinks. He had to work hard as well. With Bill Ponsford breaking his little finger, he had to field all through the England innings. Back for the third Test at the MCG, Bradman hammered 79 and 112. No one ever questioned his place in the side again. Brief scores: England 521 and 342 for 8 decl. Beat Australia 122 and 66 by 675 runs.",http://www.cricketcountry.com/articles/don-bradman-firsts-part-4-his-disappointing-test-debut-322645?utm_campaign=awesummly&utm_source=awesummly
53,Conor McGregor might never fight again: UFC President,"UFC President Dana White has said that lightweight champion Conor McGregor might never fight again owing to the amount of money he has earned. ""Try to get up and get punched in the face every day when you've got $100 million in the bank. Money changes everything with a lot of people,"" he added.","The future of UFC lightweight champion Conor McGregor remains up in the air. McGregor has not fought for the promotion since he won the lightweight title from Eddie Alvarez in November 2016. He did fight Floyd Mayweather in an incredibly lucrative boxing match in August and the Irish fighter's payday from that bout might be the reason he hasn't defended his lightweight title. Conor might never fight again, White told reporters Tuesday at UFC headquarters. The guy's got $100 (expletive) million. I've got guys that made less than that and were lawyers and went to school their whole life and quit working. Despite those words, White is hopeful that he and McGregor's team can come up with a number that will bring the promotion's biggest draw back to the octagon at some point. However, the UFC President didn't seem too interested in giving in to McGregor's recent demand for equity in the company. Despite that, White seems fully aware of what McGregor means to the UFC's bottom line. There's guys who always (expletive) about money, White said, Conor can't be paid enough money. Conor's worth every penny and more.",https://www.forbes.com/sites/trentreinsmith/2017/11/28/ufc-president-dana-white-conor-mcgregor-might-never-fight-again/?utm_campaign=awesummly&utm_source=awesummly#571c25a93c95
54,World's 1st stadium that can be reassembled to come up in Qatar,"The design of the Ras Abu Aboud Stadium, the world's first fully demountable football stadium to be used for the 2022 FIFA World Cup in Qatar, has been unveiled. Shipping containers will be used as one of the main building blocks and will have removable seats. The stadium will be capable of being reassembled or turned into multiple smaller venues.","Ras Abu Aboud's modular design also means construction of the venue will require fewer materials, create less waste and reduce the carbon footprint of the building process. Thanks to this sustainable approach to the stadium's construction, Ras Abu Aboud will receive a four-star Global Sustainability Assessment System certification. Qatar is delivering superb results in terms of sustainability, including the proposed design for Ras Abu Aboud Stadium, said Federico Addiechi, FIFA's Head of Sustainability & Diversity. From day one, there has been a strong emphasis on sustainability from Qatar, including a commitment to ensure that all infrastructure meets strict design, build and operations criteria under the GSAS certification programme. GSAS is the most far reaching green building certification. In addition to design and build, it also measures operations. This has actually informed the 2026 FIFA World Cup bidding process. Bidders are now required to adhere to all three steps regarding new developments, while existing buildings should be operated according to agreed sustainability guidelines. The 40,000-seat venue is slated for completion in 2020 and will be located in a 450,000m2 waterfront site on Doha's shore, where the use of shipping containers as one of the main building blocks will echo the nearby port. The stadium precinct, meanwhile, will offer exceptional views over Doha's landmark Corniche and into the downtown West Bay area, making it an ideal location for a waterfront development after the tournament and ensuring a vibrant local legacy. Its design also reinforces Qatar's commitment to leaving a physical legacy proportionate to Qatar's needs after the tournament, while heralding a new era of sustainable tournament infrastructure that can broaden the range of countries able to host such mega-events. The launch of the design of Ras Abu Aboud Stadium follows the design launch of Al Thumama Stadium in August 2017 and the completion of Khalifa International Stadium for the Emir Cup Final 2017 in May Ras Abu Aboud Stadium is one of eight proposed host venues for the World Cup.",http://www.fifa.com/worldcup/news/y=2017/m=11/news=sc-launches-first-ever-fully-demountable-fifa-world-cuptm-stadium-2921118.html?utm_campaign=awesummly&utm_source=awesummly
55,1st-ever int'l football match was played on a cricket ground,"The first-ever official international football match was played between England and Scotland on the cricket ground of West of Scotland Cricket Club in Scotland's largest city Glasgow on November 30, 1872. As many as 4,000 spectators turned up for the match, which finished in a 0-0 draw. England played the match with a 1-1-8 formation while Scotland used 2-2-6.","18th November 2014, Celtic Park, Glasgow - Vauxhall International Challenge Match. 14th August 2013, Wembley Stadium, London - Teenage Cancer Trust Challenge Match. 17th November 1999, Wembley Stadium, London - Euro 2000 play-off 2nd leg. 13th November 1999, Hampden Park, Glasgow - Euro 2000 play-off 1st leg. 15th June 1996, Wembley Stadium, London - Euro '96. 27th May 1989, Hampden Park, Glasgow - Rous Cup. 23rd April 1986, Wembley Stadium, London - Rous Cup. 1872 First ever Auld Enemy clash. Scotland v England on the 30th November 1872 was the first time the sides met and was also the first ever official International football match. Fittingly, the match fell on St Andrew's Day and the venue was the West of Scotland cricket club's ground at Hamilton Crescent in Partick. All of Scotland's players were from Queen's Park FC, selected by captain and goalkeeper Robert W Gardner. England's players were selected from nine different clubs by captain Charles Alcock, though he was unable to play on the day due to injury. Special trains and horsedrawn cabs were provided to cope with the large crowd. The match was played under English rules and one of the more successful tactics employed by the English team was their one handed hurl used at throw ins. On a number of occasions Charles Campbell had to clear his defensive lines by heading out the long throws. The assured combination play of the Scots backed by a strong wind created a four goal lead at half time, but with both teams changing ends it was expected that England would come back into the match. To the surprise of most Scotland managed to dominate the early exchanges and added to their lead. England came into the match late on and managed to score two goals but even the loss of the Rangers full back Tom Vallance through injury could do little to affect the final result. A rain-soaked Wembley Stadium was the setting for one of the all time great Scotland v England fixtures. Despite an early scare when English forward Billy Smith hit the post, Scotland were in an attacking mood and Alex Jackson headed the opener after just three minutes. A resolute performance by the opposition rearguard prevented the visitors from adding to their tally, nevertheless they couldn't hold on and Alex James scored the second just before half time with a left foot strike. Scotland raised their game in the second half, dominating play and undoing their opponents with sublime skill and excellent teamwork, inevitably leading to a third goal scored by Jackson, again with his head. A fourth followed soon after, Alex James netting his second with the team seemingly able to score at will. As the end of the game drew closer, Alex Jackson completed his hat-trick. To the credit of the England players, they didn't give up and Bob Kelly scored a consolation from a free-kick, leaving the final score England 1, Scotland 5. As the final whistle sounded, both sets of fans showed their appreciation for the football they had witnessed and the legendary performance of Scotland that day that saw them dubbed the 'Wembley Wizards'. At the 1937 fixture between Scotland and England a new world record for attendance at a football match was officially set at 149,415, though the unofficial attendance is thought to be higher. The record stood until the 1950 World Cup Final surpassed it, yet it remains a European record to this day. The match itself was a successful one for Scotland, comprehensively beating England 3-1. Bob McPhail scored twice and Francis O'Donnell once for the Scots with Fred Steele scoring for the English. The Scots had lost 9-3 at Wembley the year before, and had not won an 'official' international against England at Hampden since 1937. An early goal by Davy Wilson of Rangers settled the nerves, and a penalty in the last few minutes by Eric Caldow, also of Rangers, saw off the English challenge. This was a good period for the Scottish team, between 1960 and 1964 they lost only one international at Hampden and won 12. The clash with England at Wembley in 1967 is undoubtedly Scotland's most famous victory over the Auld Enemy. It was less than a year since England had been crowned World Champions and they went into this game on the back of a 19 match unbeaten run. Featuring four of Celtic's legendary 'Lisbon Lions' as well as the likes of Jim Baxter, Denis Law and Billy Bremner, Scotland were still considered massive underdogs for the game. Denis Law opened the scoring after 27 minutes, bundling the ball home from a rebounded shot by Willie Wallace. Bobby Lennox doubled the advantage on 78 minutes before Jack Charlton, moved to centre forward after sustaining an injury early on, clawed one back for England five minutes before full time. Three minutes later, debutant Jim McCalliog scored to make it 3-1 to the Scots, however Geoff Hurst hit back immediately to make it 3-2. Famously, as the match drew to a close, Rangers legend Jim Baxter slowed to a walking pace and began playing 'keepie uppie', tormenting England and their support. The amazing victory led fans to playfully dub Scotland the 'unofficial world champions'. Euro 2000 Qualifications - 2nd Leg of play-off. On the day of Craig Browns sixth anniversary at the helm of Scotland, Wembley witnessed an epic encounter as the Scots launched a furious fight back in seeking to overturn England's 2-0 first-leg advantage. England did not manage a single shot on target in the entire 90 minutes, as Scotland rocked England onto the back foot as they out fought the home side in every department. England appeared blown apart by the ferocity of the Scotland onslaught, and on the 39th minute a cross from winger Neil McCann was met by Hutchinson's head and sent into the net to send the Tartan Army into delirium. The Scots deserved to take the tie to extra time as they poured forward, and had it not been for England keeper Seaman who came to the rescue pulling of a fantastic point-blank save from Christian Dailly's header with ten minutes to go, they surely would have. The Scottish fans broke into a spontaneous rendition of Flower of Scotland in a final bid to inspire their side, however, Scotland were once again left to claim a moral victory as the solo goal from Don Hutchison left them unable to overturn England's two-goal first-leg advantage.",http://www.scottishfa.co.uk/image_gallery.cfm?utm_campaign=awesummly&page=3125&utm_source=awesummly
