Index,Title,Summary,Full Text,Url
65,Congress denies Rahul entered as non-Hindu at Somnath Temple,The Congress has denied reports that party Vice President Rahul Gandhi declared himself as a non-Hindu while entering Gujarat's Somnath Temple. The temple maintains a register at the entrance where non-Hindu visitors are required to declare their identity. Congress said the picture of Gandhi's signature in the non-Hindu register was fake and blamed the BJP for diverting from real issues.,"So when Rahul Gandhi signed up as a non-Hindu at the Somnath temple register, it became an issue. In what was apparently a goof-up, Congress president-in-waiting and pat's chief campaigner in Gujarat was listed as a non-Hindu at the temple he visited on Wednesday morning. All non-Hindus have to declare their identity at the temple. There is an image that is going viral on Twitter that shows Rahul Gandhi's name in a register. Below it is Ahmed Patel's name. This image - These two names - that of Rahul Gandhi and Ahmed Patel - were found in the register maintained for non-Hindus visiting the Somnath temple. Senior journalist Brajesh K Singh's tweet about the issue sheds light into what exactly happened at the Somnath Temple. In his tweet, Singh said, his media coordinator Manoj Tyagi mentioned Rahul Gandhi(Gandhi's) name along with Ahmed Patel(Patel's) into the spl (sic) register maintained for Non-Hindus who are visiting the temple. Major goof up in the election season(sic). It's quite obvious that Rahul Gandhi would not address himself as Rahul Gandhi Ji. It is also clear from the image that the same person has written down both Rahul's and Patel's names. Sensing the importance of the matter, Congress' media coordinator Manoj Tyagi has issued a statement. In the statement, Tyagi said, I entered just my name in the register to take media personnel inside the Somanth Temple. These would have been added later.",http://indiatoday.intoday.in/story/rahul-gandhi-somnath-temple-sign-non-hindu-register-narendra-modi-gujarat-election/1/1099611.html?utm_campaign=awesummly&utm_source=awesummly
66,"My family shiv bhakt, won't do 'dalali' over religion: Rahul","Congress Vice-President Rahul Gandhi on Thursday said that he and his family are 'shiv bhakts', but keep such things private. ""We do not want to commercialise this thing. We don't want to do 'dalali' (wheeling-dealing) over it,"" Gandhi added. He further claimed BJP workers had deliberately entered his name on a register meant for non-Hindu visitors at the Somnath temple.","A day after a controversy broke out over his religion, Congress vice-president Rahul Gandhi on Thursday said he and his family members were 'Shiv Bhakts' but asserted that he did not want to use his religion for political gains. Addressing traders in a closed-door meeting here, Gandhi said he did not need anybody's certificate about his religion, nor would he do 'dalali' (deal) over religion. My grandmother and my family are Shiv Bhakts. But we keep such things private. We generally do not speak about them. Because, we think it is a very personal matter and we don't need anyone else's certificate about it, he said. We do not want to commercialise this thing. We don't want to do 'dalali' over it. A video of his interaction was shared with the media by local Congress leaders. I will tell you what had happened (yesterday). Then I signed the visitors' book. After that, BJP people wrote my name in the second book, Gandhi alleged. On the relationship between Sardar Vallabhbhai Patel and Jawaharlal Nehru, Gandhi said they were friends despite some political and ideological differences. Though they were friends and even went to jail together, some people here are spreading lies that they were enemies. Further, there is evidence that Sardar Patel was against the RSS. But some people here are spreading a lie that he was RSS sympathiser, which is not true, he said. Gandhi's visit to the Somnath temple yesterday got mired in a controversy after his name, along with that of Ahmed Patel, was found written on the entry register meant for non- Hindus, with the Congress calling it fake and the BJP insisting the leader declare his religious faith before people. Gujarat Congress president Bharatsinh Solanki hinted that BJP president Amit Shah, who is a trustee of the temple, could be behind it. You know what he is capable of. They have stooped to such a low level that now they want to term us non-Hindus, Solanki said today. Rahul Gandhi had just written in the visitors' book that it is an 'inspiring place'. That was a clear conspiracy, Solanki said. The temple administration said Gandhi's name was written in the shrine's register for non-Hindus by his media coordinator, and its staff was not involved in the episode. Non-Hindus are allowed to visit the temple but have to first get themselves registered at the shrine's office. The signatures against their names were that of the Congress party's media coordinator, Manoj Tyagi.",http://www.hindustantimes.com/india-news/my-family-is-shiv-bhakt-won-t-do-dalali-over-religion-asserts-rahul-gandhi/story-qmIbcr2w3Dw3IOl4C1q7BJ.html?utm_campaign=awesummly&utm_source=awesummly
67,AAP given 34 chances to explain overseas donation: I-T Dept,"As the Aam Aadmi Party was fined ₹30 crore over irregularities in overseas donations, the Income Tax Department has revealed that the party was given 34 opportunities to explain its stance. The department claimed the party failed to account for the ₹13 crore it received from its overseas donors before the 2015 Delhi election.","The income-tax department has issued a Rs 30-crore notice to the Aam Aadmi party (AAP) for allegedly violating norms on collecting donations, including hawala entries worth Rs 2 crore. The order for tax assessment issued this November 23 sought the party's explanation by December 7, saying it incorrectly disclosed hawala money as voluntary donations. The AAP said the order was bogus and accused the people who run the country of muzzling the voice of Delhi's ruling party. The reference was to the BJP-led government at the Centre, with whom the AAP has a running dispute over administrative control of Delhi. The income-tax department declared all donations to the AAP in 2014-2015 as illegal, revoking tax exemptions given to it as a political party. The order came with the penalty notice for allegedly concealing its correct income, news agency PTI reported. The party has also been charged with not correctly reporting political donations received by it as stipulated under the Representation of the People Act. Tax officials said the AAP was given 34 opportunities to explain its overseas donations, especially around Rs 13.16 crore it received from supporters from overseas before the 2015 Delhi elections. The party allegedly did not disclose before the Election Commission details of Rs 6.26 crore donated by 461 donors - each donation exceeding Rs 20,000 - during the election campaign. It has been alleged that details of donations worth Rs 36.95 crore were not uploaded online and the party did not declare Rs 29.13 crore in documents submitted to the poll panel. The AAP's total taxable income for 2014-2015 was Rs 68.44 crore, according to the tax notice. The corresponding income tax was pegged at Rs 30.67 crore. Delhi chief minister and AAP national convenor, Arvind Kejriwal, responded to the notice as a case of political vendetta. All these were accounted for and shown in books of accounts, Kejriwal said in a tweet. AAP treasurer Deepak Bajpai called it a malicious attempt to target the party, though each penny that we get is accounted for. Delhi BJP leader Vijender Gupta called the income tax notice a scathing but unequivocal indictment of AAP's duplicity and unethical behaviour.",http://www.hindustantimes.com/delhi-news/income-tax-dept-sends-rs-30-crore-notice-to-delhi-cm-kejriwal-s-aap/story-w3JaFlWrjmIFlDPA1j2flM.html?utm_campaign=awesummly&utm_source=awesummly
68,Karni Sena calls Mulayam Yadav's daughter-in-law 'nachaniya',"Karni Sena leader Sukhdev Gogamedi called Samajwadi Party chief Mulayam Yadav's daughter-in-law Aparna Yadav a 'nachaniya' for performing on 'Ghoomar' song from the film 'Padmavati' at a function in Lucknow. He said people are getting wrongly inspired from the film and it should be banned. He added Yadav should quit politics and join dancing, if she doesn't agree with him. ","After targeting Deepika Padukone for Padmavati, now Karni Sena has attacked Samajwadi Party patriarch Mulayam Singh Yadav's daughter-in-law Aparna Yadav for performing dance on Ghoomar song from the controversial film. Karni Sena leader Sukhdev Gogamedi said that Sati mata wasn't like this and people are getting motivated from Padmavati. He further said that Aparna has taken inspiration from this movie and the movie should be banned and added that he would like to tell her not to this, and if she doesn't agree, then she should leave politics and join dancing.",http://indiatoday.intoday.in/video/karni-sena-aparna-yadav-padmavati-song-ghoomar-song/1/1099637.html?utm_campaign=awesummly&utm_source=awesummly
69,Rahul said Hindu terror bigger threat than LeT: Law Minister,"Union Law Minister Ravi Shankar Prasad has alleged that Congress Vice-President Rahul Gandhi had officially told US Ambassador Timothy Roemer that Hindu terrorism was a bigger threat than the Lashkar-e-Taiba (LeT). Prasad was quoting a UK-based newspaper report, which had used WikiLeaks documents as a source. Report also said Gandhi was referring to then Gujarat CM Narendra Modi, he added.","Taking forward Narendra Modi's attack on Rahul Gandhi that the Congress compromises with national interest, Union law minister Ravi Shankar Prasad said Rahul Gandhi had officially told the US Ambassador Timothy Roemer that Hindu terrorism were a bigger threat than the Lashkar-e-Taiba (LeT). And this is just within few months of the Mumbai terror attack. The report also says that Rahul was referring to then BJP chief minister of Gujarat Narendra Modi who he described as a polarising figure, he added. The newspaper report, shared by Prasad in a presser in Ahmedabad on Tuesday, is based on a leaked cable by WikiLeaks. 'The cable contained details of Rahul's conversation with the envoy at a luncheon hosted by Prime Minsiter Manmohan Singh at his residence in July 2009 in honour of visiting US secretary of State Hillary Clinton. Responding to the ambassador's query about Lashkar-e-Taiba's activities in the region and immediate threat to India, Rahul said there was evidence of some support for the group among certain elements in India's indigenous Muslim community. Another issue Prasad raised was that then Prime Minister of Congress, Manmohan Singh also compromised on national interest in Sharm-el-Sheikh in July 2009. Flashing a joint statement released by the government at the time, Prasad outlined, Gilani mentioned that Pakistan has some information on threats in Balochistan and other areas. Repeating Modi's allegation that Congress and Rahul Gandhi had insulted the Indian Army by questioning the surgical strikes as 'Khoon ki Saudagari', Prasad said, Under the brave and fearless leadership of Narendra Modi, we have empowered the Indian Army. And you can see that in the last few years, no new LeT terrorist stays alive for very long. What is the Congress's actual plan to cross the 50% cap on reservation. There are six orders of Supreme Court, four of them by five judge Bench each and one of an eight judge bench that has categorically refuted it. A document shared by him says in the Nagraja Vs UOI 2006 (8) SCC 212; Para 110 also states that a law can be challenged when reservation goes upto 50%, the court would take them up. Subsequently and states very specifically that even if the state has reasons for such reservation but goes against the cap it is liable to be set aside. Launching another attack on Congress for ignoring Sardar Vallabhbhai Patel, he said, We never said Sardar Patel was our leader. We are just questioning your treatment of him. Jawaharlal Nehru, Indira Gandhi and Rajiv Gandhi, members of the Nehru Gandhi family were prime ministers of the country for 40 years after Sardar's death. But it was when PV Narsimha was PM that Sardar was finally recognised as a Bharat Ratna.",http://indiatoday.intoday.in/story/rahul-said-hindu-terrorism-more-dangerous-than-let-ravi-shankar-prasad/1/1098898.html?utm_campaign=awesummly&utm_source=awesummly
70,TTV Dhinakaran to contest from Jayalalithaa's RK Nagar seat,"The TTV Dhinakaran-led AIADMK faction on Wednesday announced that he would contest the bypoll from RK Nagar, the assembly seat that was held by late Tamil Nadu CM Jayalalithaa. The seat fell vacant after her demise in 2016. This comes days after the Election Commission assigned the two leaves party symbol to the faction led by CM Palaniswami and Panneerselvam. ","The RK Nagar seat fell vacant after former chief minister J Jayalalithaa's demise last year. The Election Commission (EC) recently announced 21 December as the date for the bypoll. The results for these constituencies will be declared on 24 December. The camp lead by Chief Minister E Palaniswami and O Paneerselvam were allotted the AIADMK two-leaves symbol by the EC on 23 November. The decision was termed unfair by the Dhinakaran camp, who currently does not have a symbol. Earlier this year, the EC cancelled the scheduled RK Nagar bypolls after the 'cash-for-votes' scandal. Documents were seized after raids on Health Minister Vijaya Baskar, which indicated crores of rupees being set aside to distribute to voters in the constituency.",https://www.thequint.com/news/hot-news/ttv-dhinakran-to-contest-rk-nagar-bypolls-jayalalithaa?utm_campaign=awesummly&utm_source=awesummly
71,Don’t forgive BJP for atrocities on Patidars: Hardik Patel,"Patidar leader Hardik Patel on Wednesday asked the people in Gujarat not to forget and forgive the BJP for the atrocities they committed on Patidars. Dismissing BJP's charge that he's a 'Congress agent', Hardik said he is opposing BJP because Patidars were beaten up and killed and the party failed to create jobs and education opportunities for the youth.","Patidar leader Hardik Patel on Wednesday rubbished the BJP's charge that he was a 'Congress agent' and said he was against the ruling party in the state as it had failed to create jobs and education opportunities for the youth. Speaking at the same venue from where Gujarat chief minister Vijay Rupani had addressed a section of Patidars on Tuesday, Hardik said the huge crowd showed who was more popular. Let us show our strength to Vijay Rupani in Rajkot and others in faraway Gandhinagar, he said. Rupani is contesting from Rajkot West assembly constituency and Hardik decided to hold his first rally at an urban centre in his constituency. This was also his last stop in the whirlwind tour of Patidar homeland rural Saurashtra, where he addressed four meetings during the day. Referring to his August, 2015 rally in Rajkot, Hardik recalled how the police had used force against the assembled Patels. He also asked people not to forget and forgive the BJP for committing atrocities on Patidars. In western Rajkot, the venue for the event, most of the posters of local Congress candidate Indranil Rajyaguru were replaced by Hardik's. Several local Congress leaders and Patidar youth wearing caps with the 'Jai Sardar' slogan came to receive the young leader, resulting in a traffic jam on the Nana Mauva Chowk. Bhavesh Patel, 24, explained the reason behind the enthusiasm. The Son of Sardar (Patidar) is coming, he said, referring to Hardik, who had led an agitation demanding reservation in jobs and admissions in educational institutions for his community. Hardik's Patidar Anamat Andolan Samiti (PAAS) has accepted the 20% economically backward classes reservation for Patidars offered by the Congress. They say Hardik is Congress agent, Hardik is opposing the BJP. If my stand against this makes me anti-BJP, then I am, he said. Responding to Hardik, standing committee chairman at the BJP-ruled Rajkot Municipal Corporation, Pragnesh Patel, said the community knew the Congress was behind the Patidar leader's agitation. People will not get fooled,"" he said. As Gujarat gets set to vote, all eyes are on the Patidars who have the ability to influence the result.",http://www.hindustantimes.com/assembly-elections/gujarat-elections-don-t-forgive-bjp-for-atrocities-on-patidars-says-hardik-patel/story-9YdgXBDjeAkaEW5oPhf6CP.html?utm_campaign=awesummly&utm_source=awesummly
72,"Give me ₹2cr, I can put Guj CM's face: Hardik on 'sex CD'","Reacting to a sex video allegedly featuring him, Patidar leader Hardik Patel said, ""The CD is completely false, you give me ₹2 crore and I can put Vijaybhai‘s (Gujarat Chief Minister) face in the video."" Slamming those raising questions over his personal life, he further said that it was not of anyone's concern if it was him in the video.","Gujarat Patidar leader Hardik Patel on Tuesday slammed those raising questions over his personal life after a sex clip which went viral recently. The BJP has been targeting Hardik over the video which allegedly shows him with a woman. Gujarat Assembly Elections 2017: Full Coverage. Expressing anger over allegations against him, the Patidar Anamat Andolan Samiti (PAAS) leader accused the BJP of deflecting attention from real issues and said it was ploy by the ruling party to malign his image ahead of Gujarat elections. It is not of anyone's concern if it is me in the CD. The CD is completely false, you give me Rs 2 crore and I can put Vijaybhai's face in the video, Patel said. Speaking at Zee News' Game of Gujarat Conclave in Ahmedabad, Hardik Patel, who recently declared support for the Congress in the Gujarat Assembly elections, said the BJP is using 'dirty tactics' to win the elections. The alleged sex clip went viral on social media recently prompting Hardik Patel to claim that the CD was morphed. In the four-minute clip a man resembling Hardik Patel is shown with an unidentified woman. The video, which appeared to be shot in a hotel room, had a timestamp of May 16, 2017. The authenticity of the video cannot be independently verified.",http://www.india.com/news/india/hardik-patel-reacts-on-sex-cd-controversy-give-me-rs-2-crore-i-can-put-vijaybhais-face-in-it-2687086/?utm_campaign=awesummly&utm_source=awesummly
73,Ruling AIADMK group names Madhusudhanan for RK Nagar bypoll,The AIADMK faction led by Tamil Nadu CM Palaniswami and O Panneerselvam has named the party's Presidium Chairman Madhusudhanan as its candidate for the RK Nagar bypoll. The seat was left vacant after former CM Jayalalithaa's demise in 2016. The bypoll was earlier scheduled for April 12 but got cancelled by the Election Commission after reports of money distribution.,"The ruling AIADMK on Thursday announced E Madhusudhanan as its candidate for the December 21 Radhakrishnan Nagar assembly by-poll. His name was finalised from a list of aspirants, who had applied expressing willingness to contest the by-poll, a party release here said. Madhusudhanan, the party's Presidium Chairman, was the AIADMK's unanimous choice, the release from party coordinator and Tamil Nadu deputy chief Minister O Panneerselvam and co-coordinator and chief minister K Palaniswami said. DMK's M Maruthu Ganesh and sidelined AIADMK leader TTV Dhinakaran are also in the fray. The by-poll was earlier scheduled to be held on April 12. However, the polls were rescinded by the Election Commission following complaints of money distribution. Madhusudhanan was then the candidate of the Panneerselvam-led rival AIADMK faction, while Dhinakaran was contesting on the then AIADMK (Amma) camp. The factions led by Panneerselvam and Palaniswami later merged in August even as the Election Commission awarded the 'Two Leaves' symbol to the unified AIADMK. The RK Nagar seat fell vacant last December following the death of local MLA and then chief minister J Jayalalithaa on December 5, 2016.",http://www.hindustantimes.com/india-news/aiadmk-names-madhusudhanan-as-candidate-for-rk-nagar-by-poll/story-A1UKNeio3r5aZxlhE3ZjeP.html?utm_campaign=awesummly&utm_source=awesummly
74,AAP fined ₹30 crore by I-T over irregularities in donations,"The Income Tax Department has sent a notice to the AAP, directing it to pay a ₹30.67-crore fine over alleged irregularities in the donations the party had received. Putting the party's undisclosed income at ₹13 crore, the department also pulled it up for not recording full details of the 462 donors who donated ₹6 crore. ","The Income Tax Department has sent a notice to Aam Aadmi Party asking the party to pay Rs 30 crore over alleged violations in its donations. IT department has given AAP a deadline of December 7 to explain the irregularities. Sources in the department told India Today the recovery notice was pertaining to the scrutiny of AAP's donations received in 2014-2015. The department found irregularities in the donations and has deemed it as taxable earnings by the party and not political donations. The party has been asked to to pay a penalty of Rs 30.67 crore. AAP sources said this was a vindictive move by the department under the behest of the Modi Government. They said this was the first time in the history of this country that a political party's donations have been treated as taxable earnings. The first notice for an explanation was sent by the department on November 17, but the party failed to furnish satisfactory answers. Top AAP functionaries said they will not be deterred by this and will take legal recourse against the notice. The party also believed the timing of the notice was suspicious as Delhi Chief Minister Arvind Kejriwal on November 26, AAP's fifth foundation day, appealed to the voters of Gujarat to vote for any candidate who could defeat the BJP in the state.",http://indiatoday.intoday.in/story/aap-under-it-scanner-told-to-pay-rs-30-crore-penalty-over-violations-in-donations/1/1097987.html?utm_campaign=awesummly&utm_source=awesummly
75,PM Modi's campaign in Gujarat is about himself: Chidambaram,"Congress leader P Chidambaram has said that Prime Minister Narendra Modi's campaign in poll-bound Gujarat is about himself, his past and has no answer to question of joblessness and price rise. Adding that the Gujarat election is about ""the promised achhe din that hasn't come in 42 months"", he said that PM Modi has no answer to the hard reality.","Senior Congress leader P Chidambaram on Tuesday hit out at Prime Minister Narendra Modi saying that his campaign in poll-bound Gujarat is about himself, his past and has no answer to question of employment, price rise. Modi has been campaigning aggressively in his home state to ensure his party's win in what is being seen as a litmus test for the ruling Bharatiya Janata Party ahead of the 2019 Lok Sabha polls. Because he has no answers to the hard reality. The Gujarat election is not about Mr Modi, the individual. It is about the promised achhe din that has not come in 42 months, Chidambaram tweeted. Modi and his government has been constantly under fire over unemployment, price rise, demonetisation, economic growth. The Congress has been targetting the BJP on its slogan of ache din and questioned the development claims of the ruling party. The BJP, which has been trying to claim the legacy of Sardar Vallabhbhai Patel, has hit out at the Congress for ignoring India's first home minister. The Prime Minister and BJP may now desperately embrace Sardar Vallabhbhai Patel, but the redoubtable Sardar had rejected the BJP's parent RSS and its divisive ideology, Chidambaram tweeted. Modi began his high-voltage campaign with a rally in Kutch district's Bhuj town on Monday. He will address a series of campaign meetings on Wednesday in Saurashtra and South Gujarat. The two-phased Gujarat elections will be on December 9 and 14. The counting of votes and results will be declared on December 18.",http://www.india.com/news/india/gujarat-assembly-elections-2017-pm-narendra-modis-campaign-is-about-himself-his-past-tweets-p-chidambaram-2686119/?utm_campaign=awesummly&utm_source=awesummly
